[
  {
    "id": "residential_lease",
    "name_ar": "عقد إيجار سكني",
    "name_en": "Residential Lease Agreement",
    "category": "إيجار",
    "description_ar": "عقد يُبرم بين مالك الوحدة السكنية والمستأجر لتأجير عقار سكني لأغراض الإقامة. يُعدّ العقد المسجَّل على منصة إيجار ملزماً قانونياً ويُنفَّذ أمام الجهات القضائية السعودية.",
    "description_en": "A contract between a property owner and a tenant for leasing a residential unit for residential purposes. Contracts registered on the ejar platform are legally binding and enforceable before Saudi courts.",
    "required_parties": ["المالك أو من يمثله قانوناً", "المستأجر حامل الهوية الوطنية أو الإقامة"],
    "must_be_registered": true,
    "platform": "إيجار (ejar.sa)",
    "governing_regulation": "نظام الإيجار الصادر بالمرسوم الملكي م/10 لعام 1425هـ وتعديلاته",
    "key_clauses": [
      "مدة الإيجار وتاريخ البداية والنهاية",
      "قيمة الأجرة الشهرية أو السنوية بالريال السعودي",
      "آلية دفع الإيجار وطريقة التحويل",
      "التزامات الصيانة (ما يتحمله المالك وما يتحمله المستأجر)",
      "شروط إنهاء العقد قبل انتهاء مدته",
      "أحكام التجديد التلقائي",
      "حق المالك في الدخول للعقار",
      "التعديلات المسموح بها على العقار"
    ],
    "max_duration_years": 5,
    "notes_ar": "يُلزَم المالك بتسجيل العقد على منصة إيجار خلال 60 يوماً من توقيعه. يُعدّ العقد غير المسجَّل غير قابل للتنفيذ أمام محاكم الفصل في المنازعات الإيجارية."
  },
  {
    "id": "commercial_lease",
    "name_ar": "عقد إيجار تجاري",
    "name_en": "Commercial Lease Agreement",
    "category": "إيجار",
    "description_ar": "عقد إيجار يُبرم لاستخدام الوحدة العقارية في ممارسة نشاط تجاري أو صناعي أو مهني. تختلف أحكامه عن الإيجار السكني في جوانب الزيادة السنوية ومدة الإيجار وشروط التعديل.",
    "description_en": "A lease contract for using a property unit for commercial, industrial, or professional purposes. Its terms differ from residential leases regarding annual rent increases, duration, and modification clauses.",
    "required_parties": ["المالك أو الشركة المالكة", "المستأجر التجاري (شخص طبيعي أو اعتباري مرخّص)"],
    "must_be_registered": true,
    "platform": "إيجار (ejar.sa)",
    "governing_regulation": "نظام الإيجار وأحكام عقود الإيجار التجارية",
    "key_clauses": [
      "الغرض التجاري المحدد للإيجار",
      "قيمة الإيجار السنوي ونسبة الزيادة المتفق عليها",
      "التحسينات والتجهيزات المسموح بها وحق استردادها",
      "الضمانات التجارية أو خطابات الضمان البنكية",
      "حق التأجير من الباطن",
      "شروط الإخلاء ومدة الإشعار",
      "التزامات الترخيص والامتثال للأنظمة البلدية",
      "مسؤولية دفع رسوم الخدمات والكهرباء والمياه"
    ],
    "max_duration_years": 10,
    "notes_ar": "يُنصح بتوثيق عقود الإيجار التجارية لدى كاتب العدل بالإضافة إلى تسجيلها على منصة إيجار، لا سيما العقود طويلة الأمد أو ذات القيمة المالية العالية."
  },
  {
    "id": "property_sale",
    "name_ar": "عقد بيع عقار",
    "name_en": "Real Estate Sale Agreement",
    "category": "بيع",
    "description_ar": "العقد الرسمي لنقل ملكية العقار من البائع إلى المشتري. يُشترط توثيقه لدى كاتب العدل وتسجيله في منظومة التسجيل العيني للعقار (ريدز) لإتمام نقل الملكية قانونياً.",
    "description_en": "The formal contract for transferring real estate ownership from seller to buyer. Must be notarized and registered in the Real Estate Electronic Registration System (REDS) for legal ownership transfer.",
    "required_parties": ["البائع (مالك العقار المسجَّل)", "المشتري", "كاتب العدل"],
    "must_be_registered": true,
    "platform": "منظومة ريدز (REDS) — rega.gov.sa",
    "governing_regulation": "نظام التسجيل العيني للعقار الصادر بالمرسوم الملكي م/6 لعام 1423هـ",
    "key_clauses": [
      "وصف العقار وحدوده ومساحته الواردة في الصك",
      "ثمن البيع الإجمالي بالريال السعودي",
      "جدول السداد وطريقة الدفع",
      "خلو العقار من الرهون والحجوزات والحقوق العينية",
      "تاريخ التسليم الفعلي للعقار",
      "الضمانات القانونية للبائع",
      "أحكام الفسخ وحالات الإخلال",
      "توزيع رسوم التوثيق والتسجيل"
    ],
    "max_duration_years": null,
    "notes_ar": "تُفرض ضريبة التصرفات العقارية بنسبة 5% من قيمة البيع وتُسدَّد قبل إتمام التسجيل. يتحمل البائع هذه الضريبة كأصل ما لم يتفق الطرفان على خلاف ذلك."
  },
  {
    "id": "off_plan_sale",
    "name_ar": "عقد بيع على الخارطة",
    "name_en": "Off-Plan Sale Agreement",
    "category": "بيع",
    "description_ar": "عقد بيع وحدة عقارية (سكنية أو تجارية) قبل إتمام البناء، ويُلزم المطور الحاصل على ترخيص وافي بفتح حساب ضمان بنكي وإيداع مدفوعات المشترين فيه، ولا يُصرف منه إلا بحسب نسب الإنجاز المعتمدة.",
    "description_en": "A contract for purchasing a real estate unit (residential or commercial) before construction is complete. The developer must hold a wafi license, open an escrow account, and release funds only upon certified project milestones.",
    "required_parties": ["المطور العقاري الحاصل على ترخيص وافي", "المشتري"],
    "must_be_registered": true,
    "platform": "منصة وافي (wafi.rega.gov.sa)",
    "governing_regulation": "نظام التطوير العقاري الصادر بالمرسوم الملكي م/24 لعام 1443هـ",
    "key_clauses": [
      "رقم ترخيص المشروع على منصة وافي",
      "وصف الوحدة والمشروع والموقع",
      "الثمن الإجمالي وجدول الدفعات المرتبط بنسب الإنجاز",
      "التاريخ المتوقع لإتمام المشروع والتسليم",
      "بيانات حساب الضمان البنكي",
      "شروط التأخر وآلية التعويض",
      "ضمانات ما بعد التسليم (عيوب التشييد)",
      "حق المشتري في فسخ العقد عند تأخر التسليم"
    ],
    "max_duration_years": null,
    "notes_ar": "يُحظر على المطور تسويق أو بيع أي وحدة على الخارطة قبل الحصول على ترخيص وافي وفتح حساب الضمان. مخالفة ذلك تُعرّض المطور لعقوبات إدارية وجنائية."
  },
  {
    "id": "brokerage_agreement",
    "name_ar": "عقد الوساطة العقارية",
    "name_en": "Real Estate Brokerage Agreement",
    "category": "وساطة",
    "description_ar": "عقد يُبرم بين صاحب العقار (أو المشتري) والوسيط العقاري المرخَّص من الهيئة العامة للعقار، ويُحدد فيه نطاق التفويض والعمولة المستحقة وشروط التمثيل.",
    "description_en": "A contract between a property owner (or buyer) and a REGA-licensed real estate broker, specifying the scope of representation, commission rate, and terms of engagement.",
    "required_parties": ["صاحب العقار أو المشتري", "الوسيط العقاري الحاصل على تصريح من الهيئة العامة للعقار"],
    "must_be_registered": false,
    "platform": "منصة نافذة (rega.gov.sa/nafitha)",
    "governing_regulation": "نظام الوساطة العقارية ولوائحه التنفيذية الصادرة عن الهيئة العامة للعقار",
    "key_clauses": [
      "رقم ترخيص الوسيط العقاري الصادر من الهيئة العامة للعقار",
      "وصف العقار وسعر الطرح",
      "مدة عقد التفويض",
      "نسبة العمولة (لا تتجاوز 2.5% للوحدات السكنية كقاعدة عامة)",
      "حقوق الوسيط الحصرية أو غير الحصرية",
      "التزامات الوسيط التسويقية",
      "شروط انتهاء التفويض"
    ],
    "max_duration_years": 1,
    "notes_ar": "لا يحق لأي شخص مزاولة نشاط الوساطة العقارية دون الحصول على تصريح ساري من الهيئة العامة للعقار. يمكن التحقق من صحة الترخيص عبر منصة نافذة."
  },
  {
    "id": "mortgage_contract",
    "name_ar": "عقد التمويل العقاري (الرهن العقاري)",
    "name_en": "Real Estate Finance (Mortgage) Agreement",
    "category": "تمويل",
    "description_ar": "عقد تمويلي يُبرم بين جهة التمويل (بنك أو شركة تمويل مرخَّصة) والمقترض بضمان رهن العقار المموَّل. يخضع لإشراف البنك المركزي السعودي (ساما) ونظام التمويل العقاري.",
    "description_en": "A financing contract between a licensed lender (bank or finance company) and a borrower, secured by a mortgage on the financed property. Governed by SAMA and the Real Estate Finance Law.",
    "required_parties": ["جهة التمويل (بنك أو شركة تمويل مرخَّصة من ساما)", "المقترض"],
    "must_be_registered": true,
    "platform": "البنوك المرخَّصة وصندوق التنمية العقارية (REDF)",
    "governing_regulation": "نظام التمويل العقاري الصادر بالمرسوم الملكي م/50 لعام 1433هـ ولوائح البنك المركزي السعودي",
    "key_clauses": [
      "مبلغ التمويل وأجل السداد",
      "نسبة الفائدة أو هامش الربح (للتمويل الإسلامي)",
      "الجدول الزمني للأقساط الشهرية",
      "شروط الرهن العيني على العقار",
      "حق جهة التمويل في التنفيذ على العقار عند التعثر",
      "شروط السداد المبكر والغرامات المقررة",
      "التأمين الإجباري على العقار"
    ],
    "max_duration_years": 30,
    "notes_ar": "يُشترط ألا تتجاوز نسبة التمويل إلى قيمة العقار (LTV) 90% للمسكن الأول وفق تعليمات ساما. صندوق التنمية العقارية يقدم دعماً إضافياً للمواطنين المؤهلين."
  },
  {
    "id": "rent_to_own",
    "name_ar": "عقد الإيجار المنتهي بالتمليك",
    "name_en": "Rent-to-Own Agreement",
    "category": "تمويل",
    "description_ar": "صيغة تمويلية تجمع بين الإيجار والتمليك، يسكن فيها المستفيد الوحدة السكنية ويدفع أقساطاً شهرية تنتهي بتملّكه للوحدة كاملاً. يُقدَّم هذا المنتج عبر صندوق التنمية العقارية وبعض البنوك.",
    "description_en": "A hybrid financing product combining leasing and ownership, where the beneficiary occupies the unit and pays monthly installments that culminate in full ownership. Offered through REDF and select banks.",
    "required_parties": ["جهة التمويل أو الجهة الحكومية (صندوق التنمية العقارية)", "المستفيد (مواطن سعودي مؤهَّل)"],
    "must_be_registered": true,
    "platform": "صندوق التنمية العقارية (redf.gov.sa) | برنامج سكني (sakani.com.sa)",
    "governing_regulation": "أنظمة صندوق التنمية العقارية ونظام التمويل العقاري",
    "key_clauses": [
      "وصف الوحدة السكنية وموقعها",
      "القسط الشهري وأجل السداد الكامل",
      "تاريخ انتقال الملكية الفعلي عند اكتمال السداد",
      "شروط الإخلاء في حالة التعثر",
      "مسؤولية الصيانة خلال فترة الإيجار",
      "آلية معالجة الأقساط المتأخرة"
    ],
    "max_duration_years": 25,
    "notes_ar": "يقتصر هذا العقد في الغالب على المواطنين السعوديين المسجلين في برنامج سكني والمستوفين لمعايير الأهلية المحددة من صندوق التنمية العقارية."
  },
  {
    "id": "property_management",
    "name_ar": "عقد إدارة العقار",
    "name_en": "Property Management Agreement",
    "category": "إدارة",